{
  "id": "t_m365",
  "name": "M365 / Copilot Readiness Map",
  "description": "Maps data quality, permissions, SharePoint structure, Teams governance, security and enablement.",
  "category": "m365",
  "tags": [
    "m365",
    "copilot",
    "readiness",
    "microsoft"
  ],
  "style": "bridgeboard_dark_glass",
  "accent": "#2a8fa0",
  "objects": [
    {
      "type": "text",
      "text": "M365 / COPILOT READINESS MAP",
      "x": 0.05,
      "y": 0.09,
      "size": 0.03,
      "color": "#f0ebe3",
      "width": 3
    },
    {
      "type": "rect",
      "x": 0.1,
      "y": 0.2,
      "w": 0.55,
      "h": 0.085,
      "color": "#1a7a6d",
      "width": 2
    },
    {
      "type": "text",
      "text": "Data quality",
      "x": 0.13,
      "y": 0.255,
      "size": 0.022,
      "color": "#f0ebe3",
      "width": 3
    },
    {
      "type": "circle",
      "x": 0.72,
      "y": 0.21,
      "w": 0.06,
      "h": 0.06,
      "color": "#8a8a8a",
      "width": 2
    },
    {
      "type": "text",
      "text": "gap",
      "x": 0.8,
      "y": 0.255,
      "size": 0.018,
      "color": "#8a8a8a",
      "width": 3
    },
    {
      "type": "rect",
      "x": 0.1,
      "y": 0.315,
      "w": 0.55,
      "h": 0.085,
      "color": "#1a7a6d",
      "width": 2
    },
    {
      "type": "text",
      "text": "Permissions reality",
      "x": 0.13,
      "y": 0.37,
      "size": 0.022,
      "color": "#f0ebe3",
      "width": 3
    },
    {
      "type": "circle",
      "x": 0.72,
      "y": 0.325,
      "w": 0.06,
      "h": 0.06,
      "color": "#2a8fa0",
      "width": 2
    },
    {
      "type": "text",
      "text": "ready?",
      "x": 0.8,
      "y": 0.37,
      "size": 0.018,
      "color": "#8a8a8a",
      "width": 3
    },
    {
      "type": "rect",
      "x": 0.1,
      "y": 0.43,
      "w": 0.55,
      "h": 0.085,
      "color": "#1a7a6d",
      "width": 2
    },
    {
      "type": "text",
      "text": "SharePoint structure",
      "x": 0.13,
      "y": 0.485,
      "size": 0.022,
      "color": "#f0ebe3",
      "width": 3
    },
    {
      "type": "circle",
      "x": 0.72,
      "y": 0.44,
      "w": 0.06,
      "h": 0.06,
      "color": "#8a8a8a",
      "width": 2
    },
    {
      "type": "text",
      "text": "gap",
      "x": 0.8,
      "y": 0.485,
      "size": 0.018,
      "color": "#8a8a8a",
      "width": 3
    },
    {
      "type": "rect",
      "x": 0.1,
      "y": 0.545,
      "w": 0.55,
      "h": 0.085,
      "color": "#1a7a6d",
      "width": 2
    },
    {
      "type": "text",
      "text": "Teams governance",
      "x": 0.13,
      "y": 0.6,
      "size": 0.022,
      "color": "#f0ebe3",
      "width": 3
    },
    {
      "type": "circle",
      "x": 0.72,
      "y": 0.555,
      "w": 0.06,
      "h": 0.06,
      "color": "#2a8fa0",
      "width": 2
    },
    {
      "type": "text",
      "text": "ready?",
      "x": 0.8,
      "y": 0.6,
      "size": 0.018,
      "color": "#8a8a8a",
      "width": 3
    },
    {
      "type": "rect",
      "x": 0.1,
      "y": 0.66,
      "w": 0.55,
      "h": 0.085,
      "color": "#1a7a6d",
      "width": 2
    },
    {
      "type": "text",
      "text": "Security baseline",
      "x": 0.13,
      "y": 0.715,
      "size": 0.022,
      "color": "#f0ebe3",
      "width": 3
    },
    {
      "type": "circle",
      "x": 0.72,
      "y": 0.67,
      "w": 0.06,
      "h": 0.06,
      "color": "#8a8a8a",
      "width": 2
    },
    {
      "type": "text",
      "text": "gap",
      "x": 0.8,
      "y": 0.715,
      "size": 0.018,
      "color": "#8a8a8a",
      "width": 3
    },
    {
      "type": "rect",
      "x": 0.1,
      "y": 0.775,
      "w": 0.55,
      "h": 0.085,
      "color": "#1a7a6d",
      "width": 2
    },
    {
      "type": "text",
      "text": "User enablement",
      "x": 0.13,
      "y": 0.83,
      "size": 0.022,
      "color": "#f0ebe3",
      "width": 3
    },
    {
      "type": "circle",
      "x": 0.72,
      "y": 0.785,
      "w": 0.06,
      "h": 0.06,
      "color": "#2a8fa0",
      "width": 2
    },
    {
      "type": "text",
      "text": "ready?",
      "x": 0.8,
      "y": 0.83,
      "size": 0.018,
      "color": "#8a8a8a",
      "width": 3
    }
  ],
  "facilitation_notes": [
    "Permissions reality is usually the real blocker, not data quality.",
    "Mark each layer ready/gap live with the client."
  ],
  "system_prompt": "Generate a stacked M365 readiness map with six layers and a ready/gap marker per layer.",
  "version": "1.0.0",
  "created_at": "2026-06-05T00:00:00Z",
  "updated_at": "2026-06-05T00:00:00Z"
}