{
  "id": "t_map",
  "name": "People / Work / Data / Governance",
  "description": "Four-field adoption architecture canvas. Shows AI adoption is not only a tool question.",
  "category": "adoption",
  "tags": [
    "adoption",
    "architecture",
    "canvas",
    "four-field"
  ],
  "style": "bridgeboard_dark_glass",
  "accent": "#2a8fa0",
  "objects": [
    {
      "type": "text",
      "text": "AI ADOPTION ARCHITECTURE MAP",
      "x": 0.05,
      "y": 0.09,
      "size": 0.03,
      "color": "#f0ebe3",
      "width": 3
    },
    {
      "type": "rect",
      "x": 0.09,
      "y": 0.16,
      "w": 0.3975,
      "h": 0.3875,
      "color": "#1a7a6d",
      "width": 2
    },
    {
      "type": "text",
      "text": "People",
      "x": 0.12,
      "y": 0.23,
      "size": 0.03,
      "color": "#f0ebe3",
      "width": 3
    },
    {
      "type": "text",
      "text": "Enablement, roles, trust",
      "x": 0.12,
      "y": 0.28,
      "size": 0.019,
      "color": "#8a8a8a",
      "width": 3
    },
    {
      "type": "rect",
      "x": 0.5125,
      "y": 0.16,
      "w": 0.3975,
      "h": 0.3875,
      "color": "#1a7a6d",
      "width": 2
    },
    {
      "type": "text",
      "text": "Work",
      "x": 0.5425,
      "y": 0.23,
      "size": 0.03,
      "color": "#f0ebe3",
      "width": 3
    },
    {
      "type": "text",
      "text": "Processes, decisions, routines",
      "x": 0.5425,
      "y": 0.28,
      "size": 0.019,
      "color": "#8a8a8a",
      "width": 3
    },
    {
      "type": "rect",
      "x": 0.09,
      "y": 0.5725,
      "w": 0.3975,
      "h": 0.3875,
      "color": "#1a7a6d",
      "width": 2
    },
    {
      "type": "text",
      "text": "Data",
      "x": 0.12,
      "y": 0.6425,
      "size": 0.03,
      "color": "#f0ebe3",
      "width": 3
    },
    {
      "type": "text",
      "text": "Knowledge, documents, access",
      "x": 0.12,
      "y": 0.6925,
      "size": 0.019,
      "color": "#8a8a8a",
      "width": 3
    },
    {
      "type": "rect",
      "x": 0.5125,
      "y": 0.5725,
      "w": 0.3975,
      "h": 0.3875,
      "color": "#1a7a6d",
      "width": 2
    },
    {
      "type": "text",
      "text": "Governance",
      "x": 0.5425,
      "y": 0.6425,
      "size": 0.03,
      "color": "#f0ebe3",
      "width": 3
    },
    {
      "type": "text",
      "text": "Risk, policy, review",
      "x": 0.5425,
      "y": 0.6925,
      "size": 0.019,
      "color": "#8a8a8a",
      "width": 3
    }
  ],
  "facilitation_notes": [
    "Let the client fill each quadrant — don't pre-fill.",
    "Most gaps surface in Data and Governance, not People."
  ],
  "system_prompt": "Generate a four-quadrant adoption architecture map on dark glass.",
  "version": "1.1.0",
  "created_at": "2026-06-05T00:00:00Z",
  "updated_at": "2026-06-05T00:00:00Z"
}