{
  "id": "t_matrix",
  "name": "Risk / Value Matrix",
  "description": "Prioritise AI cases by governance risk and organisational value. Simple 2×2.",
  "category": "governance",
  "tags": [
    "governance",
    "risk",
    "prioritisation",
    "2x2"
  ],
  "style": "bridgeboard_dark_glass",
  "accent": "#2a8fa0",
  "objects": [
    {
      "type": "text",
      "text": "RISK / VALUE MATRIX",
      "x": 0.05,
      "y": 0.09,
      "size": 0.03,
      "color": "#f0ebe3",
      "width": 3
    },
    {
      "type": "arrow",
      "x1": 0.12,
      "y1": 0.82,
      "x2": 0.88,
      "y2": 0.82,
      "color": "#8a8a8a",
      "width": 3
    },
    {
      "type": "arrow",
      "x1": 0.12,
      "y1": 0.82,
      "x2": 0.12,
      "y2": 0.16,
      "color": "#8a8a8a",
      "width": 3
    },
    {
      "type": "text",
      "text": "Organisational value →",
      "x": 0.66,
      "y": 0.88,
      "size": 0.02,
      "color": "#8a8a8a",
      "width": 3
    },
    {
      "type": "text",
      "text": "Governance risk ↑",
      "x": 0.1,
      "y": 0.13,
      "size": 0.02,
      "color": "#8a8a8a",
      "width": 3
    },
    {
      "type": "line",
      "x1": 0.5,
      "y1": 0.16,
      "x2": 0.5,
      "y2": 0.82,
      "color": "rgba(255,255,255,.3)",
      "width": 2
    },
    {
      "type": "line",
      "x1": 0.12,
      "y1": 0.49,
      "x2": 0.88,
      "y2": 0.49,
      "color": "rgba(255,255,255,.3)",
      "width": 2
    },
    {
      "type": "text",
      "text": "Start here",
      "x": 0.6368,
      "y": 0.6352,
      "size": 0.026,
      "color": "#2a8fa0",
      "width": 3
    },
    {
      "type": "text",
      "text": "Avoid theatre",
      "x": 0.2188,
      "y": 0.6352,
      "size": 0.022,
      "color": "#8a8a8a",
      "width": 3
    },
    {
      "type": "text",
      "text": "Needs architecture",
      "x": 0.5912,
      "y": 0.3052,
      "size": 0.022,
      "color": "#1a7a6d",
      "width": 3
    },
    {
      "type": "text",
      "text": "Question hard",
      "x": 0.2112,
      "y": 0.3052,
      "size": 0.022,
      "color": "#d4416b",
      "width": 3
    }
  ],
  "facilitation_notes": [
    "Draw the risk axis before adding any use cases.",
    "'Question hard' (rose) is the only earned warning colour on the board."
  ],
  "system_prompt": "Generate a 2x2 risk vs value matrix on dark glass with four labelled quadrants.",
  "version": "1.0.0",
  "created_at": "2026-06-05T00:00:00Z",
  "updated_at": "2026-06-05T00:00:00Z"
}