{
  "id": "t_decision",
  "name": "AI Decision Layers",
  "description": "Strategic / tactical / operational decision boundaries for AI in the organisation.",
  "category": "leadership",
  "tags": [
    "leadership",
    "decisions",
    "layers",
    "briefing"
  ],
  "style": "bridgeboard_dark_glass",
  "accent": "#2a8fa0",
  "objects": [
    {
      "type": "text",
      "text": "AI DECISION LAYERS",
      "x": 0.05,
      "y": 0.09,
      "size": 0.03,
      "color": "#f0ebe3",
      "width": 3
    },
    {
      "type": "rect",
      "x": 0.12,
      "y": 0.2,
      "w": 0.76,
      "h": 0.16,
      "color": "#3d1f47",
      "width": 2
    },
    {
      "type": "text",
      "text": "Strategic",
      "x": 0.15,
      "y": 0.26,
      "size": 0.028,
      "color": "#f0ebe3",
      "width": 3
    },
    {
      "type": "text",
      "text": "Direction, risk appetite, investment",
      "x": 0.15,
      "y": 0.31,
      "size": 0.019,
      "color": "#8a8a8a",
      "width": 3
    },
    {
      "type": "rect",
      "x": 0.12,
      "y": 0.42,
      "w": 0.76,
      "h": 0.16,
      "color": "#1a7a6d",
      "width": 2
    },
    {
      "type": "text",
      "text": "Tactical",
      "x": 0.15,
      "y": 0.48,
      "size": 0.028,
      "color": "#f0ebe3",
      "width": 3
    },
    {
      "type": "text",
      "text": "Use case selection, governance design",
      "x": 0.15,
      "y": 0.53,
      "size": 0.019,
      "color": "#8a8a8a",
      "width": 3
    },
    {
      "type": "rect",
      "x": 0.12,
      "y": 0.64,
      "w": 0.76,
      "h": 0.16,
      "color": "#2a8fa0",
      "width": 2
    },
    {
      "type": "text",
      "text": "Operational",
      "x": 0.15,
      "y": 0.7,
      "size": 0.028,
      "color": "#f0ebe3",
      "width": 3
    },
    {
      "type": "text",
      "text": "Daily AI-supported decisions",
      "x": 0.15,
      "y": 0.75,
      "size": 0.019,
      "color": "#8a8a8a",
      "width": 3
    },
    {
      "type": "arrow",
      "x1": 0.9,
      "y1": 0.78,
      "x2": 0.9,
      "y2": 0.22,
      "color": "#8a8a8a",
      "width": 2
    },
    {
      "type": "text",
      "text": "delegation ↓",
      "x": 0.91,
      "y": 0.5,
      "size": 0.018,
      "color": "#8a8a8a",
      "width": 3
    }
  ],
  "facilitation_notes": [
    "Use with leadership to clarify which decisions stay human at the strategic layer.",
    "Delegation arrow shows what can move down over time."
  ],
  "system_prompt": "Generate three stacked decision tiers (strategic/tactical/operational) on dark glass with a delegation arrow.",
  "version": "1.0.0",
  "created_at": "2026-06-05T00:00:00Z",
  "updated_at": "2026-06-05T00:00:00Z"
}