{
  "id": "t_hitl",
  "name": "Human-in-the-loop Flow",
  "description": "Shows where humans review, approve, correct or escalate AI-supported work.",
  "category": "governance",
  "tags": [
    "governance",
    "hitl",
    "oversight",
    "flow"
  ],
  "style": "bridgeboard_dark_glass",
  "accent": "#2a8fa0",
  "objects": [
    {
      "type": "text",
      "text": "HUMAN-IN-THE-LOOP FLOW",
      "x": 0.05,
      "y": 0.09,
      "size": 0.03,
      "color": "#f0ebe3",
      "width": 3
    },
    {
      "type": "rect",
      "x": 0.08,
      "y": 0.42,
      "w": 0.15,
      "h": 0.13,
      "color": "#1a7a6d",
      "width": 2
    },
    {
      "type": "text",
      "text": "Input",
      "x": 0.092,
      "y": 0.5,
      "size": 0.019,
      "color": "#f0ebe3",
      "width": 3
    },
    {
      "type": "arrow",
      "x1": 0.23,
      "y1": 0.485,
      "x2": 0.2525,
      "y2": 0.485,
      "color": "#8a8a8a",
      "width": 2
    },
    {
      "type": "rect",
      "x": 0.2525,
      "y": 0.42,
      "w": 0.15,
      "h": 0.13,
      "color": "#1a7a6d",
      "width": 2
    },
    {
      "type": "text",
      "text": "AI draft",
      "x": 0.2645,
      "y": 0.5,
      "size": 0.019,
      "color": "#f0ebe3",
      "width": 3
    },
    {
      "type": "arrow",
      "x1": 0.4025,
      "y1": 0.485,
      "x2": 0.425,
      "y2": 0.485,
      "color": "#8a8a8a",
      "width": 2
    },
    {
      "type": "rect",
      "x": 0.425,
      "y": 0.42,
      "w": 0.15,
      "h": 0.13,
      "color": "#2a8fa0",
      "width": 2
    },
    {
      "type": "text",
      "text": "Human review",
      "x": 0.437,
      "y": 0.5,
      "size": 0.019,
      "color": "#f0ebe3",
      "width": 3
    },
    {
      "type": "arrow",
      "x1": 0.575,
      "y1": 0.485,
      "x2": 0.5975,
      "y2": 0.485,
      "color": "#8a8a8a",
      "width": 2
    },
    {
      "type": "rect",
      "x": 0.5975,
      "y": 0.42,
      "w": 0.15,
      "h": 0.13,
      "color": "#1a7a6d",
      "width": 2
    },
    {
      "type": "text",
      "text": "Approve / correct",
      "x": 0.6095,
      "y": 0.5,
      "size": 0.019,
      "color": "#f0ebe3",
      "width": 3
    },
    {
      "type": "arrow",
      "x1": 0.7475,
      "y1": 0.485,
      "x2": 0.77,
      "y2": 0.485,
      "color": "#8a8a8a",
      "width": 2
    },
    {
      "type": "rect",
      "x": 0.77,
      "y": 0.42,
      "w": 0.15,
      "h": 0.13,
      "color": "#1a7a6d",
      "width": 2
    },
    {
      "type": "text",
      "text": "Output",
      "x": 0.782,
      "y": 0.5,
      "size": 0.019,
      "color": "#f0ebe3",
      "width": 3
    },
    {
      "type": "arrow",
      "x1": 0.5,
      "y1": 0.42,
      "x2": 0.3275,
      "y2": 0.3,
      "color": "#d4416b",
      "width": 2
    },
    {
      "type": "text",
      "text": "escalate",
      "x": 0.3075,
      "y": 0.27,
      "size": 0.018,
      "color": "#d4416b",
      "width": 3
    }
  ],
  "facilitation_notes": [
    "The cyan box (Human review) is the point of the whole diagram.",
    "Escalation path (rose) is what makes it governable."
  ],
  "system_prompt": "Generate a left-to-right human-in-the-loop flow with a highlighted review step and an escalation branch.",
  "version": "0.9.0",
  "created_at": "2026-06-05T00:00:00Z",
  "updated_at": "2026-06-05T00:00:00Z"
}